1;2;3;4;5;6;7;8;9;10;11;12;13;14;15;16;17;18
Schluessel;Straftat;Anzahl Faelle insgesamt;Tatmonat in 2020-Januar;Tatmonat in 2020-Februar;Tatmonat in 2020-Maerz;Tatmonat in 2020-April;Tatmonat in 2020-Mai;Tatmonat in 2020-Juni;Tatmonat in 2020-Juli;Tatmonat in 2020-August;Tatmonat in 2020-September;Tatmonat in 2020-Oktober;Tatmonat in 2020-November;Tatmonat in 2020-Dezember;Tatzeit unbekannt;Schluessel gueltig von;Schluessel gueltig bis
------;Straftaten insgesamt;5,330,018;421,337;390,52;456,125;438,373;492,336;476,46;470,17;467,76;451,006;467,533;430,65;367,035;713;01.01.1971;31.12.9999
0;Straftaten gegen das Leben;2,462;239;168;230;234;224;235;232;209;194;205;143;149;0;01.01.1975;31.12.9999
10000;Mord § 211 StGB;545;63;32;53;55;41;56;54;40;43;34;36;38;0;01.01.2014;31.12.9999
10079;Sonstiger Mord;521;57;31;51;53;41;52;52;39;43;31;34;37;0;01.01.2008;31.12.9999
11000;Mord im Zusammenhang mit Raubdelikten;18;5;1;1;1;0;3;2;0;0;3;1;1;0;01.01.1999;31.12.9999
12000;Mord im Zusammenhang mit Sexualdelikten;6;1;0;1;1;0;1;0;1;0;0;1;0;0;01.01.1999;31.12.9999
20000;Totschlag und Tötung auf Verlangen §§ 212, 213, 216 StGB;1,377;109;98;121;131;133;118;129;126;111;132;78;91;0;01.01.1999;31.12.9999
20010;Totschlag § 212 StGB;1,352;104;97;116;131;129;113;129;125;110;130;77;91;0;01.01.2008;31.12.9999
20020;Minder schwerer Totschlag § 213 StGB;1;0;1;0;0;0;0;0;0;0;0;0;0;0;01.01.2008;31.12.9999
20030;Tötung auf Verlangen § 216 StGB;24;5;0;5;0;4;5;0;1;1;2;1;0;0;01.01.2008;31.12.9999
30000;Fahrlässige Tötung § 222 StGB - nicht i.V.m. Verkehrsunfall -;470;58;36;48;41;44;56;38;38;31;33;28;19;0;01.01.1993;31.12.9999
40000;Abbruch der Schwangerschaft §§ 218, 218b, 218c, 219a, 219b StGB;70;9;2;8;7;6;5;11;5;9;6;1;1;0;01.01.1999;31.12.2022
40000;Abbruch der Schwangerschaft §§ 218, 218b, 218c, 219b StGB;70;9;2;8;7;6;5;11;5;9;6;1;1;0;01.01.2023;31.12.9999
40010;Schwangerschaftsabbruch § 218 StGB;68;9;2;8;7;6;5;10;5;9;5;1;1;0;01.01.2008;31.12.9999
40020;Schwangerschaftsabbruch ohne ärztliche Feststellung, unrichtige ärztliche Feststellung § 218b StGB;2;0;0;0;0;0;0;1;0;0;1;0;0;0;01.01.2008;31.12.9999
40030;Ärztliche Pflichtverletzung § 218c StGB;0;0;0;0;0;0;0;0;0;0;0;0;0;0;01.01.2008;31.12.9999
40040;Werbung für den Abbruch der Schwangerschaft § 219a StGB;0;0;0;0;0;0;0;0;0;0;0;0;0;0;01.01.2008;31.12.2022
40050;Inverkehrbringen von Mitteln Schwangerschaftsabbruch § 219b StGB;0;0;0;0;0;0;0;0;0;0;0;0;0;0;01.01.2008;31.12.9999
100000;Straftaten gegen die sexuelle Selbstbestimmung insgesamt;76,466;6,822;5,98;6,993;6,443;8,021;8,005;7,567;6,931;5,784;5,729;4,656;3,511;24;01.01.2018;31.12.9999
110000;Straftaten gegen die sexuelle Selbstbestimmung §§ 174, 174a, 174b, 174c, 177, 178, 184i, 184j StGB;32,203;2,284;2,108;2,537;2,494;3,332;3,309;3,515;3,289;2,659;2,776;2,226;1,663;11;01.01.2017;31.12.9999
111000;Vergewaltigung, sexuelle Nötigung und sexueller Übergriff im besonders schweren Fall einschl. mit Todesfolge §§ 177, 178 StGB;9,274;770;679;804;721;944;937;939;916;728;756;593;483;4;01.01.2018;31.12.9999
111700;Vergewaltigung § 177 Abs. 6, 7, 8 StGB;8,881;737;651;767;687;897;890;901;888;703;722;572;462;4;01.01.2018;31.12.9999
111710;Vergewaltigung § 177 Abs. 6 Nr. 1, 2 StGB (ohne Schlüssel 111730);7,429;613;533;647;565;734;741;745;747;596;618;497;389;4;01.01.2018;31.12.9999
111720;Vergewaltigung im besonders schweren Fall § 177 Abs. 6 Nr. 1, 2 i. V. m. Abs. 7, 8 StGB;452;41;32;39;34;58;56;46;35;33;33;20;25;0;01.01.2018;31.12.9999
111730;Vergewaltigung von widerstandsunfähigen Personen (§ 177 Abs. 2 Nr. 1, Abs. 4) gem. § 177 Abs. 6 Nr. 1, 2 StGB;1;83;86;81;88;105;93;110;106;74;71;55;48;0;01.01.2018;31.12.9999
111800;Sexueller Übergriff und sexuelle Nötigung im besonders schweren Fall § 177 Abs. 1, 2, 4, 5 i. V. m. Abs. 6 Nr. 2, Abs. 7, 8 StGB;392;32;28;37;34;47;47;38;28;25;34;21;21;0;01.01.2018;31.12.9999
111810;Sexueller Übergriff im besonders schweren Fall § 177 Abs. 1, 2 (ohne Nr. 1) i. V. m. Abs. 6 Nr. 2, Abs. 7, 8 StGB;127;8;5;10;14;14;19;10;11;10;11;6;9;0;01.01.2018;31.12.9999
111820;Sexuelle Nötigung im besonders schweren Fall § 177 Abs. 5 i.V.m. Abs. 6 Nr. 2, Abs. 7, 8 StGB;184;18;15;16;14;25;19;18;13;12;15;11;8;0;01.01.2018;31.12.9999
111830;Sexueller Übergriff an widerstandsunfähigen Personen im besonders schweren Fall § 177 Abs. 2 Nr. 1, Abs. 4 i. V. m. Abs. 6 Nr. 2, Abs. 7, 8 StGB;81;6;8;11;6;8;9;10;4;3;8;4;4;0;01.01.2018;31.12.9999
111900;Sexueller Übergriff, sexuelle Nötigung und Vergewaltigung mit Todesfolge § 178 StGB;1;1;0;0;0;0;0;0;0;0;0;0;0;0;01.01.2018;31.12.9999
112100;Sexueller Übergriff und sexuelle Nötigung § 177 Abs. 1, 2, 4, 5, 9 StGB;5,672;452;386;478;493;603;563;603;561;446;402;384;299;2;01.01.2018;31.12.9999
112110;Sexueller Übergriff § 177 Abs. 1, 2 (ohne Nr. 1), 9 StGB;2,786;221;206;226;234;281;270;287;299;220;208;193;139;2;01.01.2018;31.12.9999
112120;Sexuelle Nötigung § 177 Abs. 5, 9 StGB;2,344;193;144;203;208;255;236;256;208;184;164;159;134;0;01.01.2018;31.12.9999
112130;Sexueller Übergriff an widerstandsunfähigen Personen § 177 Abs. 2 Nr. 1, Abs. 4, 9 StGB;542;38;36;49;51;67;57;60;54;42;30;32;26;0;01.01.2018;31.12.9999
113000;Sexueller Missbrauch von Schutzbefohlenen pp., unter Ausnutzung einer Amtsstellung oder eines Vertrauensverhältnisses §§ 174, 174a-c StGB;393;43;28;35;36;34;40;35;28;27;21;35;31;0;01.01.2014;31.12.9999
113010;Sexueller Missbrauch von Schutzbefohlenen ab 14 Jahren § 174 StGB;220;24;13;21;22;24;22;17;20;13;10;16;18;0;01.01.2019;31.12.9999
113020;Sexueller Missbrauch von Gefangenen/Verwahrten usw. ab 14 Jahren § 174a StGB;40;5;4;2;3;0;8;5;4;2;1;4;2;0;01.01.2008;31.12.9999
113030;Sexueller Missbrauch - Ausnutzung einer Amtsstellung zum Nachteil von Personen ab 14 Jahren § 174b StGB;5;0;0;0;1;1;1;1;0;0;1;0;0;0;01.01.2008;31.12.9999
113040;Sexueller Missbrauch - Ausnutzung eines Beratungs-/Behandlungs-/Betreuungsverhältnisses zum Nachteil von Personen ab 14 Jahren § 174c StGB;128;14;11;12;10;9;9;12;4;12;9;15;11;0;01.01.2008;31.12.9999
114000;Sexuelle Belästigung § 184i StGB;16,853;1,019;1,015;1,22;1,243;1,751;1,766;1,936;1,784;1,457;1,596;1,212;849;5;01.01.2019;31.12.9999
115000;Straftaten aus Gruppen § 184j StGB;11;0;0;0;1;0;3;2;0;1;1;2;1;0;01.01.2019;31.12.9999
130000;Sexueller Missbrauch §§ 176-176e, 182, 183, 183a StGB;18,576;1,413;1,205;1,475;1,361;1,987;2,106;2,011;1,924;1,583;1,522;1,16;822;7;01.01.2022;31.12.9999
131000;Sexueller Missbrauch von Kindern §§ 176-176e StGB;9,521;878;717;830;782;1,01;965;919;808;831;732;591;452;6;01.01.2022;31.12.9999
131010;Sexueller Missbrauch von Kindern - Anbieten von Kindern gemäß §§ 176 Abs. 1 Nr 3, 176a Abs.2, 176b Abs. 2 StGB;239;14;19;18;18;22;32;24;19;19;16;22;16;0;01.01.2022;31.12.9999
131011;Sexueller Missbrauch von Kindern - Kinder für sex. Handlungen anbietet, Nachweis verspricht § 176 Abs. 1 Nr. 3 StGB;94;5;9;9;7;10;13;6;5;11;4;7;8;0;01.01.2022;31.12.9999
131012;Sexueller Missbrauch von Kindern - Kinder für sex. Missbrauch ohne Körperkontakt anbietet, Nachweis verspricht, zur Tat verabredet § 176a Abs. 2 StGB;113;8;10;8;6;5;17;16;13;5;9;13;3;0;01.01.2022;31.12.9999
131013;Sexueller Missbrauch von Kindern - Kind zum vorbereitenden Einwirken anbietet, Nachweis verspricht, zur Tat verabredet § 176b Abs. 2 StGB;32;1;0;1;5;7;2;2;1;3;3;2;5;0;01.01.2022;31.12.9999
131100;Sexueller Missbrauch von Kindern - sexuelle Handlungen an Kind/durch Kind vornehmen lässt § 176 Abs 1 Nr. 1 und 2 StGB;3,868;341;279;333;292;414;423;423;324;306;279;258;192;4;01.01.2022;31.12.9999
131200;Exhibitionistische/sexuelle Handlungen vor Kindern § 176a Abs. 1 Nr. 1 StGB;1,246;68;72;93;93;158;166;123;141;121;98;66;47;0;01.01.2022;31.12.9999
131300;Sexueller Missbrauch von Kindern - Täter bestimmt Kind, sexuelle Handlungen an sich selbst vorzunehmen § 176a Abs 1 Nr. 2 StGB;449;31;41;36;37;38;51;40;38;32;51;34;20;0;01.01.2022;31.12.9999
131400;"Sexueller Missbrauch von Kindern - Einwirken auf Kinder ohne Körperkontakt § 176a Abs. 1 Nr. 3; 176b Abs. 1 Nr. 1 und 2 StGB";2,314;281;205;228;222;242;165;158;158;229;186;135;104;1;01.01.2022;31.12.9999
131410;Sexueller Missbrauch von Kindern - Einwirken auf Kinder ohne Körperkontakt mit dem Kind § 176a Abs. 1 Nr 3 i.V.m. Absatz 3 StGB;1,916;242;162;191;182;202;137;132;127;200;148;107;85;1;01.01.2022;31.12.9999
131411;Sexueller Missbrauch von Kindern - Einwirken auf Kind durch pornographischen Inhalt oder entsprechende Reden § 176a Abs. 1 Nr. 3 StGB;1,788;225;149;179;176;196;131;116;111;187;136;98;83;1;01.01.2022;31.12.9999
131412;Versuch des Sexuellen Missbrauchs von Kindern ohne Körperkontakt mit dem Kind (Scheinkindkonstellation) § 176a Abs. 1 nr. 3 i.V.m. Abs. 3 StGB;128;17;13;12;6;6;6;16;16;13;12;9;2;0;01.01.2022;31.12.9999
131420;Vorbereitung des sexuellen Missbrauchs von Kindern gem § 176b Abs. 1, 3 StGB;398;39;43;37;40;40;28;26;31;29;38;28;19;0;01.01.2022;31.12.9999
131421;Sexueller Missbrauch von Kindern - Einwirken auf Kind zur Vorbereitung sex. Missbrauchs § 176b Abs. 1 StGB;329;31;36;31;34;34;24;22;27;25;30;22;13;0;01.01.2022;31.12.9999
131422;Versuch der Vorbereitung des sexuellen Missbrauchs von Kindern (Scheinkindkonstellation) § 176b Abs. 1 i.V.m. Abs. 3 StGB;69;8;7;6;6;6;4;4;4;4;8;6;6;0;01.01.2022;31.12.9999
131500;Schwerer Sexueller Missbrauch von Kindern - Vollzug des Beischlafs mit einem Kind oder Vornahme einer ähnlichen sexuellen Handlung nach § 176c Abs. 1 Nr. 2 StGB;641;70;42;48;56;60;57;78;55;59;41;38;36;1;01.01.2022;31.12.9999
131600;Schwerer sexueller Missbrauch von Kindern - Herstellung und Verbreitung pornographischer Inhalte § 176c Abs. 2 StGB;70;5;2;5;4;4;8;7;6;10;9;6;4;0;01.01.2022;31.12.9999
131700;Schwerer sexueller Missbrauch von Kindern - sonstige Begehungsweisen gem. § 176c StGB;681;67;56;67;56;71;63;66;67;53;52;30;33;0;01.01.2022;31.12.9999
131710;Schwerer sexueller Missbrauch von Kindern - sonstige Begehungsweisen § 176c Abs. 1 Nr. 1, 3, 4 StGB;678;67;56;67;56;71;63;65;67;52;51;30;33;0;01.01.2022;31.12.9999
131720;Schwerer sexueller Missbrauch von Kindern - mit schwerer körperlicher Misshandlung oder Gefahr des Todes § 176c Abs. 3 StGB;3;0;0;0;0;0;0;1;0;1;1;0;0;0;01.01.2022;31.12.9999
131800;Sexueller Missbrauch von Kindern mit Todesfolge § 176d StGB;0;0;0;0;0;0;0;0;0;0;0;0;0;0;01.01.2022;31.12.9999
131900;Verbreitung und Besitz von Anleitungen zu sexuellem Missbrauch von Kindern § 176e StGB;13;1;1;2;4;1;0;0;0;2;0;2;0;0;01.01.2022;31.12.9999
132000;Exhibitionistische Handlungen und Erregung öffentlichen Ärgernisses §§ 183, 183a StGB;8,27;469;439;573;522;907;1,068;995;1,049;679;730;510;329;0;01.01.1987;31.12.9999
132010;Exhibitionistische Handlungen § 183 StGB;6,912;393;390;471;436;751;881;813;859;579;620;430;289;0;01.01.2008;31.12.9999
132020;Erregung öffentlichen Ärgernisses § 183a StGB;1,358;76;49;102;86;156;187;182;190;100;110;80;40;0;01.01.2008;31.12.9999
133000;Sexueller Missbrauch von Jugendlichen § 182 StGB;785;66;49;72;57;70;73;97;67;73;60;59;41;1;01.01.2018;31.12.9999
133100;Sexueller Missbrauch von Jugendlichen gegen Entgelt § 182 Abs. 2 StGB;207;21;11;18;19;19;16;28;15;14;14;19;13;0;01.01.2018;31.12.9999
133700;Sonstiger Sexueller Missbrauch von Jugendlichen § 182 StGB;578;45;38;54;38;51;57;69;52;59;46;40;28;1;01.01.2018;31.12.9999
140000;Ausnutzen sexueller Neigung §§ 180, 180a, 181a, 184, 184a, 184b, 184c, 184e, 184f, 184g, 184k, 184l StGB;25,687;3,125;2,667;2,981;2,588;2,702;2,59;2,041;1,718;1,542;1,431;1,27;1,026;6;01.01.2022;31.12.9999
140010;Ausübung der verbotenen Prostitution § 184f StGB;532;56;62;63;39;48;32;37;26;51;44;34;40;0;01.01.2016;31.12.9999
140020;Jugendgefährdende Prostitution § 184g StGB;7;0;0;1;0;0;1;2;0;0;1;0;2;0;01.01.2016;31.12.9999
141000;Förderung sexueller Handlungen Minderjähriger oder Ausbeuten von Prostituierten §§ 180, 180a StGB;77;13;7;6;6;13;1;13;4;6;1;6;1;0;01.01.2014;31.12.9999
141100;Förderung sexueller Handlungen Minderjähriger § 180 StGB;74;13;6;6;6;12;1;13;3;6;1;6;1;0;01.01.2018;31.12.9999
141110;Förderung sexueller Handlungen Minderjähriger durch Vermittlung oder gegen Entgelt § 180 Abs. 1, Nr. 1, Abs. 2 StGB;43;9;3;4;2;4;1;10;2;4;0;4;0;0;01.01.2018;31.12.9999
141179;Sonstige Förderung sexueller Handlungen Minderjähriger § 180 StGB;31;4;3;2;4;8;0;3;1;2;1;2;1;0;01.01.2018;31.12.9999
141200;Ausbeuten von Prostituierten § 180a StGB;3;0;1;0;0;1;0;0;1;0;0;0;0;0;01.01.2002;31.12.9999
142000;Zuhälterei § 181a StGB;98;11;10;12;7;9;7;9;6;10;9;2;6;0;01.01.2006;31.12.9999
143000;Verbreitung pornografischer Inhalte (Erzeugnisse) §§ 184, 184a, 184b, 184c, 184e StGB;24,096;2,995;2,531;2,839;2,473;2,555;2,443;1,875;1,581;1,398;1,3;1,179;921;6;01.01.2022;31.12.9999
143010;Sonstige Verbreitung pornografischer Inhalte (Erzeugnisse) § 184 StGB;2,168;255;227;182;188;204;167;176;168;166;169;164;102;0;01.01.2022;31.12.9999
143020;Verbreitung gewalt- oder tierpornografischer Inhalte § 184a StGB;109;4;12;18;9;3;11;16;9;3;5;9;9;1;01.01.2022;31.12.9999
143040;Veranstaltung und Besuch kinder- und jugendpornografischer Darbietungen § 184e StGB;1;0;0;1;0;0;0;0;0;0;0;0;0;0;01.01.2016;31.12.9999
143100;Verbreitung pornografischer Inhalte (Erzeugnisse) an Personen unter 18 Jahren § 184 Abs. 1 Nr. 1, 2, 5 StGB;1,227;131;113;129;91;125;116;70;80;93;95;76;108;0;01.01.2022;31.12.9999
143200;Verbreitung, Erwerb, Besitz und Herstellung kinderpornografischer Inhalte § 184b StGB;17,306;2,152;1,859;2,115;1,869;1,917;1,843;1,364;1,105;935;851;749;544;3;01.01.2022;31.12.9999
143210;Verbreitung, Erwerb, Besitz und Herstellung von Kinderpornografie § 184b Abs. 1 StGB;12,018;1,554;1,325;1,539;1,352;1,336;1,228;942;741;589;536;492;384;0;01.01.2016;31.12.9999
143211;Verbreitung von Kinderpornografie § 184b Abs. 1 Nr. 1 StGB;10,23;1,323;1,131;1,314;1,189;1,126;1,065;799;616;512;446;408;301;0;01.01.2016;31.12.9999
143212;Besitzverschaffung für andere von Kinderpornografie § 184b Abs. 1 Nr. 2 StGB;669;83;76;81;61;64;45;43;45;33;43;44;51;0;01.01.2016;31.12.2022
143212;Besitzverschaffung für andere von Kinderpornografie § 184b Abs. 1 Nr. 2 StGB;566;110;77;87;50;70;51;37;30;13;16;18;7;0;01.01.2023;31.12.9999
143213;Herstellung auch ohne Verbreitungsabsicht von Kinderpornografie mit tatsächlichem Geschehen § 184b Abs. 1 Nr. 3 StGB;231;18;21;23;16;27;28;27;25;14;9;12;11;0;01.01.2016;31.12.9999
143214;Herstellung mit Verbreitungsabsicht von Kinderpornografie § 184b Abs. 1 Nr. 4 StGB;219;16;16;28;29;36;23;29;17;11;12;1;1;0;01.01.2016;31.12.2022
143214;Herstellung mit Verbreitungsabsicht von Kinderpornografie § 184b Abs. 1 Nr. 4 StGB;103;4;4;6;7;13;16;7;8;6;10;9;13;0;01.01.2023;31.12.9999
143220;Verbreitung und Herstellung von Kinderpornografie gewerbs-/bandenmäßig § 184b Abs. 2 StGB;26;0;3;5;4;3;2;3;2;1;1;1;1;0;01.01.2016;31.12.9999
143230;Besitz oder sich Verschaffen von Kinderpornografie § 184b Abs. 3 StGB;2,788;435;381;377;302;339;307;197;135;136;110;54;13;2;01.01.2016;31.12.2022
143230;Besitz oder sich Verschaffen von Kinderpornografie § 184b Abs. 3 StGB;2,474;163;150;194;211;239;306;222;227;209;204;202;146;1;01.01.2023;31.12.9999
143500;Verbreitung, Erwerb, Besitz und Herstellung jugendpornografischer Inhalte § 184c StGB;3,285;453;320;394;316;306;306;249;219;201;180;181;158;2;01.01.2022;31.12.9999
143510;Verbreitung, Erwerb, Besitz und Herstellung von Jugendpornografie § 184c Abs. 1 StGB;2,153;291;212;253;214;211;206;154;142;126;126;110;107;1;01.01.2016;31.12.9999
143511;Verbreitung von Jugendpornografie § 184c Abs. 1 Nr. 1 StGB;1,689;237;159;213;170;166;158;122;112;90;97;83;81;1;01.01.2016;31.12.9999
143512;Besitzverschaffung für andere von Jugendpornografie § 184c Abs. 1 Nr. 2 StGB;209;24;32;13;24;24;20;10;9;18;8;11;16;0;01.01.2016;31.12.9999
143513;Herstellung auch ohne Verbreitungsabsicht mit tatsächlichem Geschehen von Jugendpornografie § 184c Abs. 1 Nr. 3 StGB;109;13;10;5;7;9;12;10;8;10;13;9;3;0;01.01.2016;31.12.9999
143514;Herstellung mit Verbreitungsabsicht von Jugendpornografie § 184c Abs. 1 Nr. 4 StGB;146;17;11;22;13;12;16;12;13;8;8;7;7;0;01.01.2016;31.12.9999
143520;Verbreitung und Herstellung von Jugendpornografie gewerbs-/bandenmäßig § 184c Abs. 2 StGB;15;2;2;2;2;1;0;0;3;1;1;1;0;0;01.01.2016;31.12.9999
143530;Besitz oder sich Verschaffen von Jugendpornografie § 184c Abs. 3 StGB;1,117;160;106;139;100;94;100;95;74;74;53;70;51;1;01.01.2016;31.12.9999
145000;Verletzung des Intimbereichs durch Bildaufnahmen § 184k StGB;848;48;53;58;58;75;105;103;100;76;73;44;55;0;01.01.2021;31.12.9999
146000;Inverkehrbringen, Erwerb und Besitz von Sexpuppen mit kindlichem Erscheinungsbild § 184l StGB;29;2;4;2;5;2;1;2;1;1;3;5;1;0;01.01.2022;31.12.9999
200000;Rohheitsdelikte und Straftaten gegen die persönliche Freiheit;862,223;61,513;58,525;70,357;69,259;83,649;82,432;82,856;81,111;72,305;76,473;65,413;58,286;44;01.01.1971;31.12.9999
210000;Raub, räuberische Erpressung und räuberischer Angriff auf Kraftfahrer §§ 249-252, 255, 316a StGB;38,589;2,733;2,663;3,175;3,034;3,493;3,463;3,461;3,416;3,383;3,801;3,319;2,646;2;01.01.2014;31.12.9999
210010;Sonstiger Raub § 249 StGB;3,672;205;215;286;301;303;360;365;333;378;381;297;248;0;01.01.2013;31.12.9999
210020;Sonstiger schwerer Raub § 250 StGB;1,12;72;72;85;71;99;86;126;93;94;115;115;91;1;01.01.2008;31.12.9999
210030;Sonstiger Raub mit Todesfolge § 251 StGB;0;0;0;0;0;0;0;0;0;0;0;0;0;0;01.01.2008;31.12.9999
210040;Räuberischer Diebstahl § 252 StGB;9,271;603;699;764;736;767;834;794;848;830;864;850;682;0;01.01.2008;31.12.9999
210050;Sonstige räuberische Erpressung § 255 StGB;2,767;190;215;247;226;286;223;208;193;261;289;240;188;1;01.01.2008;31.12.9999
211000;Raub, räuberische Erpressung auf/gegen Geldinstitute, Postfilialen und -agenturen;58;6;6;8;5;3;5;3;7;2;4;4;5;0;01.01.2014;31.12.9999
211100;Raub, räuberische Erpressung auf/gegen Geldinstitute (Banken/Sparkassen);35;3;4;3;3;2;4;2;4;2;3;1;4;0;01.01.2001;31.12.9999
211110;Raub auf Geldinstitute (Banken/Sparkassen) § 249 StGB;4;0;1;0;0;0;1;0;1;0;0;1;0;0;01.01.2013;31.12.9999
211120;Schwerer Raub auf Geldinstitute (Banken/Sparkassen) § 250 StGB;11;1;1;1;1;1;0;0;2;0;3;0;1;0;01.01.2008;31.12.9999
211130;Raub mit Todesfolge auf Geldinstitute (Banken/Sparkassen) § 251 StGB;0;0;0;0;0;0;0;0;0;0;0;0;0;0;01.01.2008;31.12.9999
211150;Räuberische Erpressung gegen Geldinstitute (Banken/Sparkassen) § 255 StGB;20;2;2;2;2;1;3;2;1;2;0;0;3;0;01.01.2008;31.12.9999
211200;Raub, räuberische Erpressung auf/gegen Postfilialen und -agenturen;23;3;2;5;2;1;1;1;3;0;1;3;1;0;01.01.2011;31.12.9999
211210;Raub auf Postfilialen und -agenturen § 249 StGB;3;0;0;1;1;0;0;0;0;0;0;1;0;0;01.01.2013;31.12.9999
211220;Schwerer Raub auf Postfilialen und -agenturen § 250 StGB;9;2;1;2;0;0;1;1;0;0;1;0;1;0;01.01.2011;31.12.9999
211230;Raub mit Todesfolge auf Postfilialen und -agenturen § 251 StGB;0;0;0;0;0;0;0;0;0;0;0;0;0;0;01.01.2011;31.12.9999
211250;Räuberische Erpressung gegen Postfilialen und -agenturen § 255 StGB;11;1;1;2;1;1;0;0;3;0;0;2;0;0;01.01.2011;31.12.9999
212000;Raub, räuberische Erpressung auf/gegen sonstige Kassenräume und Geschäfte;1,93;230;172;194;173;125;114;128;140;128;167;194;165;0;01.01.2020;31.12.9999
212010;Raub auf sonstige Kassenräume oder Geschäfte § 249 StGB;148;18;11;15;2;9;12;10;10;19;10;13;19;0;01.01.2020;31.12.9999
212020;Schwerer Raub auf sonstige Kassenräume oder Geschäfte § 250 StGB;601;61;63;63;62;43;34;29;41;41;45;68;51;0;01.01.2020;31.12.9999
212030;Raub mit Todesfolge auf sonstige Kassenräume oder Geschäfte § 251 StGB;0;0;0;0;0;0;0;0;0;0;0;0;0;0;01.01.2020;31.12.9999
212050;Räuberische Erpressung gegen sonstige Kassenräume oder Geschäfte § 255 StGB;380;53;37;45;39;23;25;33;24;20;31;29;21;0;01.01.2020;31.12.9999
212100;Raub, räuberische Erpressung auf/gegen Spielhallen;205;18;20;17;29;19;5;20;16;15;17;18;11;0;01.01.1990;31.12.9999
212110;Raub auf Spielhallen § 249 StGB;11;0;1;1;2;1;0;0;0;1;3;1;1;0;01.01.2013;31.12.9999
212120;Schwerer Raub auf Spielhallen § 250 StGB;122;12;12;13;12;14;2;13;8;9;9;11;7;0;01.01.2008;31.12.9999
212130;Raub mit Todesfolge auf Spielhallen § 251 StGB;0;0;0;0;0;0;0;0;0;0;0;0;0;0;01.01.2008;31.12.9999
212150;Räuberische Erpressung gegen Spielhallen § 255 StGB;72;6;7;3;15;4;3;7;8;5;5;6;3;0;01.01.2008;31.12.9999
212200;Raub, räuberische Erpressung auf/gegen Tankstellen;596;80;41;54;41;31;38;36;49;33;64;66;63;0;01.01.1990;31.12.9999
212210;Raub auf Tankstellen § 249 StGB;51;11;1;4;3;1;3;2;5;2;3;11;5;0;01.01.2013;31.12.9999
212220;Schwerer Raub auf Tankstellen § 250 StGB;363;40;24;34;25;20;25;26;28;21;42;36;42;0;01.01.2008;31.12.9999
212230;Raub mit Todesfolge auf Tankstellen § 251 StGB;0;0;0;0;0;0;0;0;0;0;0;0;0;0;01.01.2008;31.12.9999
212250;Räuberische Erpressung gegen Tankstellen § 255 StGB;182;29;16;16;13;10;10;8;16;10;19;19;16;0;01.01.2008;31.12.9999
213000;Raub, räuberische Erpressung auf/gegen Geld- und Werttransporte;16;2;0;2;2;4;0;3;1;1;0;1;0;0;01.01.2014;31.12.9999
213100;Raub, räuberische Erpressung auf/gegen Geld- und Kassenboten;16;2;0;2;2;4;0;3;1;1;0;1;0;0;01.01.1981;31.12.9999
213110;Raub auf Geld- und Kassenboten § 249 StGB;4;0;0;0;0;2;0;2;0;0;0;0;0;0;01.01.2013;31.12.9999
213120;Schwerer Raub auf Geld- und Kassenboten § 250 StGB;10;2;0;1;2;1;0;1;1;1;0;1;0;0;01.01.2008;31.12.9999
213130;Raub mit Todesfolge auf Geld- und Kassenboten § 251 StGB;0;0;0;0;0;0;0;0;0;0;0;0;0;0;01.01.2008;31.12.9999
213150;Räuberische Erpressung gegen Geld- und Kassenboten § 255 StGB;2;0;0;1;0;1;0;0;0;0;0;0;0;0;01.01.2008;31.12.9999
213200;Raub, räuberische Erpressung auf/gegen Spezialgeldtransportfahrzeuge;0;0;0;0;0;0;0;0;0;0;0;0;0;0;01.01.1981;31.12.9999
213210;Raub auf Spezialgeldtransportfahrzeuge § 249 StGB;0;0;0;0;0;0;0;0;0;0;0;0;0;0;01.01.2013;31.12.9999
213220;Schwerer Raub auf Spezialgeldtransportfahrzeuge § 250 StGB;0;0;0;0;0;0;0;0;0;0;0;0;0;0;01.01.2008;31.12.9999
213230;Raub mit Todesfolge auf Spezialgeldtransportfahrzeuge § 251 StGB;0;0;0;0;0;0;0;0;0;0;0;0;0;0;01.01.2008;31.12.9999
213250;Räuberische Erpressung gegen Spezialgeldtransportfahrzeuge § 255 StGB;0;0;0;0;0;0;0;0;0;0;0;0;0;0;01.01.2008;31.12.9999
214000;Räuberischer Angriff auf Kraftfahrer § 316a StGB;120;12;10;11;9;10;6;13;13;9;9;10;8;0;01.01.2014;31.12.9999
214079;Räuberischer Angriff auf sonstige Kraftfahrer;77;5;4;6;7;6;3;10;11;6;6;7;6;0;01.01.2008;31.12.9999
214100;Beraubung von Taxifahrern;43;7;6;5;2;4;3;3;2;3;3;3;2;0;01.01.1971;31.12.9999
216000;Handtaschenraub;1,083;88;74;80;73;110;98;97;106;86;82;112;77;0;01.01.1971;31.12.9999
216010;Handtaschenraub § 249 StGB;948;72;68;71;62;94;86;83;88;80;76;98;70;0;01.01.2013;31.12.9999
216020;Handtaschenraub § 250 StGB;106;11;6;9;9;12;10;10;15;5;5;10;4;0;01.01.2008;31.12.9999
216030;Handtaschenraub mit Todesfolge § 251 StGB;0;0;0;0;0;0;0;0;0;0;0;0;0;0;01.01.2008;31.12.9999
216050;Räuberische Erpressung bei Handtaschenraub § 255 StGB;29;5;0;0;2;4;2;4;3;1;1;4;3;0;01.01.2008;31.12.9999
217000;Sonstige Raubüberfälle auf Straßen, Wegen oder Plätzen;16,373;1,117;1,033;1,298;1,246;1,579;1,555;1,532;1,506;1,429;1,727;1,338;1,013;0;01.01.1971;31.12.9999
217010;Sonstiger Raub auf Straßen, Wegen oder Plätzen § 249 StGB;9,382;591;532;688;684;911;971;939;914;849;1;720;583;0;01.01.2013;31.12.9999
217020;Sonstiger schwerer Raub auf Straßen, Wegen oder Plätzen § 250 StGB;3,267;231;233;276;260;300;275;308;282;266;367;277;192;0;01.01.2008;31.12.9999
217030;Sonstiger Raub mit Todesfolge auf Straßen, Wegen oder Plätzen § 251 StGB;3;1;0;0;0;0;1;1;0;0;0;0;0;0;01.01.2008;31.12.9999
217050;Sonstige räuberische Erpressung auf Straßen, Wegen oder Plätzen § 255 StGB;3,721;294;268;334;302;368;308;284;310;314;360;341;238;0;01.01.2008;31.12.9999
218000;Raub zur Erlangung von Betäubungsmitteln;90;11;10;9;6;5;12;8;4;7;5;3;10;0;01.01.1972;31.12.9999
218010;Raub zur Erlangung von Betäubungsmitteln § 249 StGB;35;5;2;2;1;1;6;6;2;3;1;1;5;0;01.01.2013;31.12.9999
218020;Schwerer Raub zur Erlangung von Betäubungsmitteln § 250 StGB;30;3;7;5;2;1;1;1;1;3;2;1;3;0;01.01.2008;31.12.9999
218030;Raub mit Todesfolge zur Erlangung von Betäubungsmitteln § 251 StGB;0;0;0;0;0;0;0;0;0;0;0;0;0;0;01.01.2008;31.12.9999
218050;Räuberische Erpressung zur Erlangung von Betäubungsmitteln § 255 StGB;25;3;1;2;3;3;5;1;1;1;2;1;2;0;01.01.2008;31.12.9999
219000;Raubüberfälle in Wohnungen;2,089;197;157;191;186;202;170;184;172;158;158;155;159;0;01.01.1981;31.12.9999
219010;Raub in Wohnungen § 249 StGB;987;100;69;86;81;83;90;103;86;80;73;66;70;0;01.01.2013;31.12.9999
219020;Schwerer Raub in Wohnungen § 250 StGB;592;43;39;52;61;74;46;50;50;44;33;45;55;0;01.01.2008;31.12.9999
219030;Raub mit Todesfolge in Wohnungen § 251 StGB;0;0;0;0;0;0;0;0;0;0;0;0;0;0;01.01.2008;31.12.9999
219050;Räuberische Erpressung in Wohnungen § 255 StGB;510;54;49;53;44;45;34;31;36;34;52;44;34;0;01.01.2008;31.12.9999
220000;Körperverletzung §§ 223-227, 229, 231 StGB;570,051;38,923;37,212;46,174;46,256;56,993;55,132;55,625;53,728;47,729;50,86;42,475;38,92;24;01.01.2014;31.12.9999
221000;Körperverletzung mit Todesfolge §§ 227, 231 StGB;87;8;8;8;4;9;4;11;9;7;3;6;10;0;01.01.1999;31.12.9999
221010;Körperverletzung mit Todesfolge § 227 StGB;86;8;8;8;4;9;4;10;9;7;3;6;10;0;01.01.2008;31.12.9999
221020;Beteiligung an einer Schlägerei mit Todesfolge § 231 StGB;1;0;0;0;0;0;0;1;0;0;0;0;0;0;01.01.2008;31.12.9999
222000;Gefährliche und schwere Körperverletzung, Verstümmelung weiblicher Genitalien §§ 224, 226, 226a, 231 StGB;142,328;9,704;9,385;11,992;11,521;14,872;13,877;13,865;13,491;11,766;12,725;10,225;8,903;2;01.01.2014;31.12.9999
222010;Sonstige Tatörtlichkeit bei gefährlicher Körperverletzung § 224 StGB;81,534;5,899;5,628;7,098;6,753;8,196;7,628;7,582;7,508;6,744;7,141;5,969;5,386;2;01.01.2008;31.12.9999
222020;Sonstige Tatörtlichkeit bei schwerer Körperverletzung § 226 StGB;258;22;15;16;16;19;34;29;33;23;18;21;12;0;01.01.2008;31.12.9999
222030;Sonstige Tatörtlichkeit bei Beteiligung an einer Schlägerei ohne Todesfolge § 231 StGB;20;2;1;2;1;3;1;1;2;6;0;0;1;0;01.01.2008;31.12.9999
